{
  "schema_version": "1.0",
  "lesson_id": "e0-s0-walking-skeleton",
  "plan_hash": "1111111111111111111111111111111111111111111111111111111111111111",
  "segments": [
    {
      "id": "seg-0001",
      "speaker": "narrator",
      "spoken_text": "A cache stores reusable work.",
      "style": "calm_explanatory",
      "pause_after_ms": 400,
      "take": 0,
      "cache_key": "2222222222222222222222222222222222222222222222222222222222222AAA"
    }
  ]
}
